{
  "skill": "qveris-a-stock-data-layer",
  "source_record": {
    "candidate_number": 58,
    "original_repository": "A-Stock Data",
    "github_url": "https://github.com/simonlin1212/a-stock-data",
    "license": "Apache-2.0",
    "evaluation_recent_activity": "2026-06-28",
    "local_source_snapshot": "third_party/source_repos/58-a-stock-data",
    "snapshot_latest_commit": "bcda405 on 2026-06-28"
  },
  "controls": {
    "dry_run": false,
    "max_calls": 6,
    "max_age": "P1D",
    "budget_note": "fallback after unavailable specialty routes"
  },
  "analysis": {
    "summary": "The market-data layer is usable, but specialty A-share fields are missing because no verified QVeris CAP was available.",
    "fallback": "classification and top movers may be used only as proxy context, not as capital-flow or limit-board evidence"
  },
  "risk_notes": [
    "Do not infer strong market heat from proxy-only top movers.",
    "Do not replace failed QVeris calls with original source endpoints."
  ],
  "missing_fields": [
    "limit_board_pool capability_unavailable",
    "capital_flow capability_unavailable",
    "investor_qa capability_unavailable"
  ],
  "data_quality": {
    "status": "proxy_only",
    "warnings": [
      "capability_unavailable",
      "proxy_only_sector_context"
    ],
    "stale_fields": [],
    "out_of_window_events": [],
    "suppressed_fields": [
      "target_price",
      "rating",
      "buy_sell"
    ]
  },
  "qveris_trace": [
    {
      "tool_name": "qveris_finance.mkt_top_movers",
      "params": {
        "market": "CN",
        "limit": 20
      },
      "status": "success",
      "execution_id": null,
      "fallback_used": true,
      "missing_fields": [
        "capital_flow",
        "limit_board_pool"
      ]
    }
  ],
  "disclaimer": "Not investment advice.",
  "suppressed_fields": [
    "target_price",
    "rating",
    "buy_sell"
  ],
  "observed_call_count": 1
}
