{
  "skill": "qveris-uzi-equity-research",
  "source_record": {
    "candidate_number": 34,
    "original_repository": "UZI-Skill",
    "github_url": "https://github.com/wbh604/UZI-Skill",
    "license": "MIT",
    "evaluation_recent_activity": "2026-07-07",
    "local_source_snapshot": "third_party/source_repos/34-uzi-skill",
    "snapshot_latest_commit": "fce996c on 2026-07-07"
  },
  "controls": {
    "dry_run": false,
    "max_calls": 10,
    "max_age": "P1D",
    "budget_note": "Prioritize identity, market data, fundamentals, and requested review layer."
  },
  "analysis": {
    "workflow": "equity_research_note",
    "entity": "600519.SH",
    "evidence_status": "partial",
    "summary": "Identity and basic research context are supported; LHB and trap-risk specialty evidence remain conditional.",
    "valuation_output_allowed": "method_audit_only"
  },
  "risk_notes": [
    "Valuation output is an assumption audit only.",
    "A-share specialty evidence must pass current cap-detail or one canonical direct fallback plus row-level identity checks.",
    "CN financials and ratios must pass the A-share availability matrix before use."
  ],
  "missing_fields": [
    "validated_lhb_rows",
    "validated_large_order_flow",
    "validated_trap_risk_social_evidence",
    "forward_valuation_assumptions"
  ],
  "qveris_trace": [
    {
      "tool_name": "qveris_finance.ref_symbology",
      "params": {
        "symbol": "600519.SH",
        "market": "CN"
      },
      "status": "success",
      "execution_id": null,
      "fallback_used": false,
      "missing_fields": []
    },
    {
      "tool_name": "qveris_finance.fundamentals_derived_ratios",
      "params": {
        "symbol": "600519.SH",
        "market": "CN"
      },
      "status": "success",
      "execution_id": null,
      "fallback_used": false,
      "missing_fields": [
        "forward_assumptions"
      ]
    }
  ],
  "disclaimer": "Not investment advice.",
  "data_quality": {
    "status": "partial",
    "warnings": [
      "LHB and trap-risk specialty routes are conditional and not used as primary evidence in this sample.",
      "Valuation model output is suppressed; only input coverage is reported."
    ],
    "stale_fields": [],
    "out_of_window_events": [],
    "suppressed_fields": [
      "target_price",
      "upside",
      "recommendation",
      "buy_sell",
      "safe_to_trade"
    ]
  },
  "suppressed_fields": [
    "target_price",
    "upside",
    "recommendation",
    "buy_sell",
    "safe_to_trade"
  ],
  "observed_call_count": 2
}
